{
  "$schema": "https://json-schema.org/draft/2020-12/schema",
  "title": "SiteDesignSpec",
  "type": "object",
  "additionalProperties": false,
  "required": [
    "schema_version",
    "spec_id",
    "workflow_mode",
    "content_revision",
    "decision_order",
    "decisions",
    "engineering_constraints",
    "requirements_approval"
  ],
  "properties": {
    "schema_version": {"enum": [3, 4]},
    "spec_id": {"type": "string", "minLength": 1},
    "workflow_mode": {"enum": ["full", "fast-change"]},
    "content_revision": {"type": "integer", "minimum": 1},
    "decision_order": {
      "const": [
        "structure",
        "typography",
        "color",
        "media",
        "primary_motion",
        "secondary_motion"
      ]
    },
    "decisions": {
      "type": "object",
      "additionalProperties": false,
      "required": [
        "structure",
        "typography",
        "color",
        "media",
        "primary_motion",
        "secondary_motion"
      ],
      "properties": {
        "structure": {
          "oneOf": [
            {"$ref": "#/$defs/singleDecision"},
            {"$ref": "#/$defs/agentDelegatedStructure"}
          ]
        },
        "typography": {"$ref": "#/$defs/singleDecision"},
        "color": {"$ref": "#/$defs/singleDecision"},
        "media": {
          "oneOf": [
            {"$ref": "#/$defs/singleDecision"},
            {"$ref": "#/$defs/skippedMedia"}
          ]
        },
        "primary_motion": {"$ref": "#/$defs/singleDecision"},
        "secondary_motion": {"$ref": "#/$defs/multipleDecision"}
      }
    },
    "engineering_constraints": {
      "type": "array",
      "minItems": 5,
      "uniqueItems": true,
      "items": {"type": "string", "minLength": 1},
      "allOf": [
        {"contains": {"const": "responsive"}},
        {"contains": {"const": "accessible"}},
        {"contains": {"const": "coarse-pointer"}},
        {"contains": {"const": "reduced-motion"}},
        {"contains": {"const": "media-fallbacks"}}
      ]
    },
    "requirements_approval": {"$ref": "#/$defs/approval"},
    "migration": {"type": ["object", "null"]}
  },
  "$defs": {
    "candidate": {
      "type": "object",
      "additionalProperties": false,
      "required": [
        "id",
        "label",
        "fit",
        "risks",
        "tradeoffs",
        "compatibility",
        "responsive_fallback",
        "accessibility_notes",
        "source_ids"
      ],
      "properties": {
        "id": {"type": "string", "minLength": 1},
        "label": {"type": "string", "minLength": 1},
        "fit": {
          "type": "array",
          "minItems": 1,
          "items": {"type": "string", "minLength": 1}
        },
        "risks": {
          "type": "array",
          "minItems": 1,
          "items": {"type": "string", "minLength": 1}
        },
        "tradeoffs": {
          "type": "array",
          "minItems": 1,
          "items": {"type": "string", "minLength": 1}
        },
        "compatibility": {
          "type": "array",
          "items": {"type": "string", "minLength": 1}
        },
        "responsive_fallback": {"type": "string", "minLength": 1},
        "accessibility_notes": {
          "type": "array",
          "minItems": 1,
          "items": {"type": "string", "minLength": 1}
        },
        "source_ids": {
          "type": "array",
          "minItems": 1,
          "uniqueItems": true,
          "items": {"type": "string", "minLength": 1}
        }
      }
    },
    "approval": {
      "type": "object",
      "additionalProperties": false,
      "required": ["status", "source", "channel"],
      "properties": {
        "status": {"const": "user_approved"},
        "source": {"const": "explicit_user"},
        "channel": {"const": "conversation"}
      }
    },
    "preview": {
      "type": "object",
      "additionalProperties": false,
      "required": ["offered", "response", "delivery", "artifact"],
      "properties": {
        "offered": {"const": true},
        "response": {"enum": ["accepted", "declined"]},
        "delivery": {
          "enum": ["local-gallery", "static-fallback", "not-requested"]
        },
        "artifact": {
          "type": ["string", "null"],
          "pattern": "^\\.resume-site-work/style-preview/sessions/[^/]+/gallery\\.html$"
        }
      },
      "allOf": [
        {
          "if": {"properties": {"response": {"const": "declined"}}},
          "then": {
            "properties": {
              "delivery": {"const": "not-requested"},
              "artifact": {"type": "null"}
            }
          },
          "else": {
            "properties": {
              "delivery": {"enum": ["local-gallery", "static-fallback"]},
              "artifact": {"type": "string"}
            }
          }
        }
      ]
    },
    "decisionBase": {
      "type": "object",
      "additionalProperties": false,
      "required": [
        "status",
        "discovery_report",
        "candidates",
        "recommended_candidate_id",
        "tentative_selection_ids",
        "selected_candidate_ids",
        "preview",
        "approval"
      ],
      "properties": {
        "status": {"const": "confirmed"},
        "discovery_report": {
          "type": "string",
          "pattern": "^\\.resume-site-work/reports/design-discovery/(structure|typography|color|media|primary-motion|secondary-motion)\\.json$"
        },
        "candidates": {
          "type": "array",
          "minItems": 2,
          "uniqueItems": true,
          "items": {"$ref": "#/$defs/candidate"}
        },
        "recommended_candidate_id": {"type": "string", "minLength": 1},
        "tentative_selection_ids": {
          "type": "array",
          "minItems": 1,
          "uniqueItems": true,
          "items": {"type": "string", "minLength": 1}
        },
        "selected_candidate_ids": {
          "type": "array",
          "minItems": 1,
          "uniqueItems": true,
          "items": {"type": "string", "minLength": 1}
        },
        "preview": {"$ref": "#/$defs/preview"},
        "approval": {"$ref": "#/$defs/approval"}
      }
    },
    "singleDecision": {
      "allOf": [
        {"$ref": "#/$defs/decisionBase"},
        {
          "properties": {
            "tentative_selection_ids": {"maxItems": 1},
            "selected_candidate_ids": {"maxItems": 1}
          }
        }
      ]
    },
    "multipleDecision": {"$ref": "#/$defs/decisionBase"},
    "agentDelegatedStructure": {
      "type": "object",
      "additionalProperties": false,
      "required": ["status", "priority", "scope", "exploration_policy", "direct_generation", "approval"],
      "properties": {
        "status": {"const": "agent_delegated"},
        "priority": {"const": "visual-impact"},
        "scope": {"const": "universal"},
        "exploration_policy": {"const": "fit-novelty-wildcard"},
        "direct_generation": {"const": true},
        "approval": {"$ref": "#/$defs/approval"}
      }
    },
    "skippedMedia": {
      "type": "object",
      "additionalProperties": false,
      "required": ["status", "skip_reason", "approval"],
      "properties": {
        "status": {"const": "skipped"},
        "skip_reason": {"type": "string", "minLength": 1},
        "approval": {"$ref": "#/$defs/approval"}
      }
    }
  }
}
